{
  "schemaVersion": 1,
  "id": "progress",
  "source": {
    "canonicalPath": "src/components/ui/progress.tsx",
    "canonicalBlobSha": "e43eac7ea965a431e622d45f391cbd82b85e88e5",
    "implementationKind": "semantic-token-normalized-derivative",
    "upstreamPath": "apps/v4/registry/bases/radix/ui/progress.tsx",
    "upstreamBlobSha": "e53ba770fb79db26862ddaab7c51db2c0257af7d"
  },
  "evidence": {
    "source": {
      "kind": "canonical-source",
      "source": "src/components/ui/progress.tsx@e43eac7ea965a431e622d45f391cbd82b85e88e5"
    },
    "declaration": {
      "kind": "inherited-interface",
      "source": "radix.progress.root"
    },
    "tokens": {
      "kind": "token-contract",
      "source": "shadcn-radix-token-contract-003"
    }
  },
  "exports": [
    {
      "name": "Progress",
      "kind": "component",
      "authorableJsx": true,
      "evidenceRefs": [
        "source"
      ],
      "component": {
        "localProps": [],
        "inherits": [
          "radix.progress.root"
        ],
        "slots": [],
        "composition": {
          "requires": [],
          "provides": [],
          "hardConstraints": []
        },
        "stateChannels": [],
        "conditionalApi": [],
        "events": [],
        "tokenDependencies": [
          {
            "tokenId": "spacing.unit",
            "viaDerivedRule": {
              "id": "spacing.multiplier",
              "multiplier": 1
            },
            "evidenceRefs": [
              "source",
              "tokens"
            ]
          },
          {
            "tokenId": "color.muted",
            "evidenceRefs": [
              "source",
              "tokens"
            ]
          },
          {
            "tokenId": "color.primary",
            "evidenceRefs": [
              "source",
              "tokens"
            ]
          },
          {
            "tokenId": "radius.full",
            "evidenceRefs": [
              "source",
              "tokens"
            ]
          }
        ],
        "rendering": {
          "rootNodeId": "root",
          "publicPropsTargetNodeId": "root",
          "nodes": [
            {
              "id": "root",
              "host": {
                "kind": "inherited-interface",
                "interfaceId": "radix.progress.root"
              },
              "receivesPublicProps": true,
              "dataAttributes": [
                {
                  "name": "data-slot",
                  "source": "literal",
                  "value": "progress",
                  "evidenceRefs": [
                    "source"
                  ]
                }
              ],
              "children": [
                {
                  "nodeId": "indicator",
                  "evidenceRefs": [
                    "source"
                  ]
                }
              ],
              "evidenceRefs": [
                "source"
              ]
            },
            {
              "id": "indicator",
              "host": {
                "kind": "inherited-interface",
                "interfaceId": "radix.progress.indicator"
              },
              "receivesPublicProps": false,
              "dataAttributes": [
                {
                  "name": "data-slot",
                  "source": "literal",
                  "value": "progress-indicator",
                  "evidenceRefs": [
                    "source"
                  ]
                }
              ],
              "children": [],
              "evidenceRefs": [
                "source"
              ]
            }
          ],
          "portalBoundaries": []
        },
        "accessibility": [
          {
            "feature": "progressbar semantics and value ARIA",
            "owner": "component",
            "mechanism": "Radix Progress Root supplies role=progressbar and aria-valuemin/aria-valuemax/aria-valuenow/aria-valuetext from value, max, and getValueLabel",
            "evidenceRefs": [
              "source",
              "declaration"
            ]
          }
        ],
        "inheritedPropDefaults": [
          {
            "propName": "max",
            "value": 100,
            "evidenceRefs": [
              "source"
            ]
          }
        ]
      }
    }
  ],
  "unresolved": []
}
