{
  "schemaVersion": 1,
  "id": "spinner",
  "source": {
    "canonicalPath": "src/components/ui/spinner.tsx",
    "canonicalBlobSha": "69fc59c84e0b2b6717d7e66ce3632dc444b31910",
    "implementationKind": "semantic-token-normalized-derivative",
    "upstreamPath": "apps/v4/registry/bases/radix/ui/spinner.tsx",
    "upstreamBlobSha": "2a91bf988618e87a3698133b0bd971a00ec3f61b"
  },
  "evidence": {
    "source": {
      "kind": "canonical-source",
      "source": "src/components/ui/spinner.tsx@69fc59c84e0b2b6717d7e66ce3632dc444b31910"
    },
    "tokens": {
      "kind": "token-contract",
      "source": "shadcn-radix-token-contract-002"
    },
    "runtime": {
      "kind": "runtime-test",
      "source": "tests/release-005-spinner-runtime.test.tsx"
    }
  },
  "exports": [
    {
      "name": "Spinner",
      "kind": "component",
      "authorableJsx": true,
      "evidenceRefs": [
        "source"
      ],
      "component": {
        "localProps": [],
        "inherits": [
          "html.svg"
        ],
        "slots": [],
        "composition": {
          "requires": [],
          "provides": [],
          "hardConstraints": []
        },
        "stateChannels": [],
        "conditionalApi": [],
        "events": [],
        "tokenDependencies": [
          {
            "tokenId": "spacing.unit",
            "viaDerivedRule": {
              "id": "spacing.multiplier",
              "multiplier": 4
            },
            "evidenceRefs": [
              "source",
              "tokens"
            ]
          }
        ],
        "rendering": {
          "rootNodeId": "host",
          "publicPropsTargetNodeId": "host",
          "nodes": [
            {
              "id": "host",
              "host": {
                "kind": "inherited-interface",
                "interfaceId": "html.svg"
              },
              "receivesPublicProps": true,
              "dataAttributes": [
                {
                  "name": "data-slot",
                  "source": "literal",
                  "value": "spinner",
                  "evidenceRefs": [
                    "source"
                  ]
                }
              ],
              "children": [],
              "evidenceRefs": [
                "source",
                "runtime"
              ]
            }
          ],
          "portalBoundaries": []
        },
        "accessibility": [
          {
            "feature": "loading status semantics",
            "owner": "component",
            "mechanism": "rendered icon receives role=\"status\"",
            "evidenceRefs": [
              "source",
              "runtime"
            ]
          },
          {
            "feature": "default accessible name",
            "owner": "component",
            "mechanism": "rendered icon receives aria-label=\"Loading\" unless overridden by forwarded props",
            "evidenceRefs": [
              "source",
              "runtime"
            ]
          }
        ],
        "inheritedPropDefaults": [
          {
            "propName": "role",
            "value": "status",
            "evidenceRefs": [
              "source",
              "runtime"
            ]
          },
          {
            "propName": "aria-label",
            "value": "Loading",
            "evidenceRefs": [
              "source",
              "runtime"
            ]
          }
        ]
      }
    }
  ],
  "unresolved": []
}
